{
  "approval": "candidate_unapproved",
  "deployments": [
    {
      "address": "0x000000000022D473030F116dDEE9F6B43aC78BA3",
      "approval": "candidate_unapproved",
      "assertions": [],
      "chain_id": 10,
      "id": "candidate:10:permit2:permit2",
      "implementation": null,
      "network_id": "optimism-mainnet",
      "official_sources": [
        {
          "retrieved": "2026-10-08",
          "url": "https://github.com/Uniswap/permit2"
        }
      ],
      "permission_type": "permit2",
      "pin_status": "not_read_offline",
      "protocol_id": "permit2",
      "protocol_version": "1",
      "proxy_kind": "none",
      "proxy_kind_basis": "The deployment file records one contract address and does not describe a proxy. protocol_version is 1 because that file has no version field.",
      "record_status": "candidate",
      "revoked_at": null,
      "runtime_hash": null,
      "source_block_hash": null,
      "source_block_number": null,
      "source_files": [
        "config/deployments/permit2/optimism-mainnet.json"
      ],
      "user_approved": false,
      "valid_until": null
    },
    {
      "address": "0x000000000022D473030F116dDEE9F6B43aC78BA3",
      "approval": "candidate_unapproved",
      "assertions": [],
      "chain_id": 137,
      "id": "candidate:137:permit2:permit2",
      "implementation": null,
      "network_id": "polygon-pos",
      "official_sources": [
        {
          "retrieved": "2026-10-08",
          "url": "https://github.com/Uniswap/permit2"
        }
      ],
      "permission_type": "permit2",
      "pin_status": "not_read_offline",
      "protocol_id": "permit2",
      "protocol_version": "1",
      "proxy_kind": "none",
      "proxy_kind_basis": "The deployment file records one contract address and does not describe a proxy. protocol_version is 1 because that file has no version field.",
      "record_status": "candidate",
      "revoked_at": null,
      "runtime_hash": null,
      "source_block_hash": null,
      "source_block_number": null,
      "source_files": [
        "config/deployments/permit2/polygon-pos.json"
      ],
      "user_approved": false,
      "valid_until": null
    },
    {
      "address": "0x83F20F44975D03b1b09e64809B757c47f942BEeA",
      "approval": "candidate_unapproved",
      "assertions": [],
      "chain_id": 1,
      "id": "candidate:1:erc4626_pins:sdai",
      "implementation": null,
      "network_id": "ethereum-mainnet",
      "official_sources": [
        {
          "retrieved": "2026-10-10",
          "url": "https://docs.spark.fi/dev/savings/sdai-token"
        }
      ],
      "permission_type": "erc4626_vault",
      "pin_status": "not_read_offline",
      "protocol_id": "erc4626_pins",
      "protocol_version": "1",
      "proxy_kind": "none",
      "proxy_kind_basis": "The packaged notes say the implementation identity is at this address.",
      "record_status": "candidate",
      "revoked_at": null,
      "runtime_hash": null,
      "source_block_hash": null,
      "source_block_number": null,
      "source_files": [
        "config/protocols/erc4626-pins.json"
      ],
      "user_approved": false,
      "valid_until": null
    },
    {
      "address": "0xBBBBBbbBBb9cC5e90e3b3Af64bdAF62C37EEFFCb",
      "approval": "candidate_unapproved",
      "assertions": [],
      "chain_id": 1,
      "id": "candidate:1:erc4626_pins:steakhouse_morpho",
      "implementation": null,
      "network_id": "ethereum-mainnet",
      "official_sources": [
        {
          "retrieved": "2026-10-10",
          "url": "https://docs.morpho.org/get-started/resources/addresses/"
        }
      ],
      "permission_type": "morpho_like",
      "pin_status": "not_read_offline",
      "protocol_id": "erc4626_pins",
      "protocol_version": "1",
      "proxy_kind": "none",
      "proxy_kind_basis": "The packaged notes name Morpho Blue at this address.",
      "record_status": "candidate",
      "revoked_at": null,
      "runtime_hash": null,
      "source_block_hash": null,
      "source_block_number": null,
      "source_files": [
        "config/protocols/erc4626-pins.json"
      ],
      "user_approved": false,
      "valid_until": null
    },
    {
      "address": "0xBEEF01735c132Ada46AA9aA4c54623cAA92A64CB",
      "approval": "candidate_unapproved",
      "assertions": [],
      "chain_id": 1,
      "id": "candidate:1:erc4626_pins:steakhouse_usdc",
      "implementation": null,
      "network_id": "ethereum-mainnet",
      "official_sources": [
        {
          "retrieved": "2026-10-10",
          "url": "https://github.com/morpho-org/metamorpho"
        }
      ],
      "permission_type": "erc4626_vault",
      "pin_status": "not_read_offline",
      "protocol_id": "erc4626_pins",
      "protocol_version": "1",
      "proxy_kind": "none",
      "proxy_kind_basis": "The packaged notes say the implementation identity is at this address.",
      "record_status": "candidate",
      "revoked_at": null,
      "runtime_hash": null,
      "source_block_hash": null,
      "source_block_number": null,
      "source_files": [
        "config/protocols/erc4626-pins.json"
      ],
      "user_approved": false,
      "valid_until": null
    },
    {
      "address": "0x000000000022D473030F116dDEE9F6B43aC78BA3",
      "approval": "candidate_unapproved",
      "assertions": [],
      "chain_id": 1,
      "id": "candidate:1:permit2:permit2",
      "implementation": null,
      "network_id": "ethereum-mainnet",
      "official_sources": [
        {
          "retrieved": "2026-10-08",
          "url": "https://github.com/Uniswap/permit2"
        }
      ],
      "permission_type": "permit2",
      "pin_status": "not_read_offline",
      "protocol_id": "permit2",
      "protocol_version": "1",
      "proxy_kind": "none",
      "proxy_kind_basis": "The deployment file records one contract address and does not describe a proxy. protocol_version is 1 because that file has no version field.",
      "record_status": "candidate",
      "revoked_at": null,
      "runtime_hash": null,
      "source_block_hash": null,
      "source_block_number": null,
      "source_files": [
        "config/deployments/permit2/ethereum-mainnet.json"
      ],
      "user_approved": false,
      "valid_until": null
    },
    {
      "address": "0x000000000022D473030F116dDEE9F6B43aC78BA3",
      "approval": "candidate_unapproved",
      "assertions": [],
      "chain_id": 42161,
      "id": "candidate:42161:permit2:permit2",
      "implementation": null,
      "network_id": "arbitrum-one",
      "official_sources": [
        {
          "retrieved": "2026-10-08",
          "url": "https://github.com/Uniswap/permit2"
        }
      ],
      "permission_type": "permit2",
      "pin_status": "not_read_offline",
      "protocol_id": "permit2",
      "protocol_version": "1",
      "proxy_kind": "none",
      "proxy_kind_basis": "The deployment file records one contract address and does not describe a proxy. protocol_version is 1 because that file has no version field.",
      "record_status": "candidate",
      "revoked_at": null,
      "runtime_hash": null,
      "source_block_hash": null,
      "source_block_number": null,
      "source_files": [
        "config/deployments/permit2/arbitrum-one.json"
      ],
      "user_approved": false,
      "valid_until": null
    },
    {
      "address": "0x000000000022D473030F116dDEE9F6B43aC78BA3",
      "approval": "candidate_unapproved",
      "assertions": [],
      "chain_id": 43114,
      "id": "candidate:43114:permit2:permit2",
      "implementation": null,
      "network_id": "avalanche-c",
      "official_sources": [
        {
          "retrieved": "2026-10-08",
          "url": "https://github.com/Uniswap/permit2"
        }
      ],
      "permission_type": "permit2",
      "pin_status": "not_read_offline",
      "protocol_id": "permit2",
      "protocol_version": "1",
      "proxy_kind": "none",
      "proxy_kind_basis": "The deployment file records one contract address and does not describe a proxy. protocol_version is 1 because that file has no version field.",
      "record_status": "candidate",
      "revoked_at": null,
      "runtime_hash": null,
      "source_block_hash": null,
      "source_block_number": null,
      "source_files": [
        "config/deployments/permit2/avalanche-c.json"
      ],
      "user_approved": false,
      "valid_until": null
    },
    {
      "address": "0x1adB950d8bB3dA4bE104211D5AB038628e477fE6",
      "approval": "candidate_unapproved",
      "assertions": [],
      "chain_id": 56,
      "id": "candidate:56:lista_slisbnb:proxy",
      "implementation": null,
      "network_id": "bsc-mainnet",
      "official_sources": [
        {
          "retrieved": "2026-10-07",
          "url": "https://docs.bsc.lista.org/for-developer/liquid-staking-slisbnb/mechanics"
        },
        {
          "retrieved": "2026-10-09",
          "url": "https://docs.bsc.lista.org/for-developer/liquid-staking-slisbnb/smart-contract"
        }
      ],
      "permission_type": "queue_vault",
      "pin_status": "not_read_offline",
      "protocol_id": "lista_slisbnb",
      "protocol_version": "1",
      "proxy_kind": "eip1967_impl",
      "proxy_kind_basis": "The EIP-1967 implementation slot constant is in action-client/src/trusted-lista.mjs. This generator does not read a chain, so the implementation address stays unpinned.",
      "record_status": "candidate",
      "revoked_at": null,
      "runtime_hash": null,
      "source_block_hash": null,
      "source_block_number": null,
      "source_files": [
        "config/protocols/lista-bsc.json",
        "config/protocols/lista-slisbnb.json"
      ],
      "user_approved": false,
      "valid_until": null
    },
    {
      "address": "0x000000000022D473030F116dDEE9F6B43aC78BA3",
      "approval": "candidate_unapproved",
      "assertions": [],
      "chain_id": 56,
      "id": "candidate:56:permit2:permit2",
      "implementation": null,